Ticket id,Interaction id,Ticket Summary,Interaction content,Type 1,Type 2,Type 3,Type 4,hierarchical_label
23003,64386,RE : [AppGallery]Probleme și sugestii,"Dear Customer, thank you for contacting Aspiegel.We hope you feel good.To give you the best solution, please specify your request with the following information: 1. A problem description 2. A screenshot or a video record of the error 3. The moment the problem appeared 4. Your Huawei Id: App Galleryhms Coredesclan and then make a screenshot 5. your phone model 6. SN number of your device 7. App Gallery: Huawei App Galleryme> About (About) 8. HMS Core: Huawei App GalleryHms> About.9. Cone app 10. Version of the corresponding application 11. The application gallery journal if you have additional questions, please answer this email message and we will be happy to help you.With great consideration, Andrea Aspiegel",AppGallery ,Suggestion,AppGallery-Use,Others,AppGallery  > Suggestion > AppGallery-Use > Others
23002,64348,Aspiegel Support issue submit,"Product: InApp Purchase Requests: View, change or cancel subscriptions Contact Full Name: Lukas Pur Phone Number: *****(PHONE) Contact Email Address: Lxxxxxxxxxcom Summary of the issue: Hello I have problem with music player app JetAudio+ I bought the app long time ago from Play store. Long before *****(PERSON) Id was a thing and after last phone update i am reqired to buy it again via *****(PERSON) Id Home | News | Events | Products | Partners | Support Copyright Aspiegel SE",AppGallery ,Others,Unknown,Unknown,AppGallery  > Others > Unknown > Unknown
23002,64355,RE : JetAudio+,"Dear *****(PERSON), Thank you for contacting *****(PERSON). We hope youre doing well. This email is regarding your concern about buying the JetAudio+ app from the PlayStore, and after the update you are required to purchase it again via *****(PERSONwei ID. Dont worry I perfectly understand your request and will be happy to assist you further with the best solution. In order for us to investigate this issue further , would you be so kind to send us the following details : Model : Go to SettingsAbout phonemodel When did the problem : occur date & time *****(PERSONwei ID : Email address or phone number used to register HUAWEI ID *****(PERSONwei ID register countryregion : Go to SettingsHUAWEI IDSettingsCountry Screenshotvideo of the issue Build number : Go to SettingsAbout phone >Build number HMS version : Go to SettingsAbout phone >Build number SN (Serial Number of phone) : Go to SettingsAbout phoneStatusSerial number For further questions, please feel free to reply to this email thread and we will be happy to walk you through your doubts. Sincerely, Cristiana *****(PERSON)",AppGallery ,Problem/Fault,AppGallery-Install/Upgrade,Other download/install/update issue,AppGallery  > Problem/Fault > AppGallery-Install/Upgrade > Other download/install/update issue
22994,64318,[AppGallery]Problems and suggestions,Description No instrol Contact information *****(PHONE),AppGallery ,Suggestion,General,Others,AppGallery  > Suggestion > General > Others
22994,64321,RE : [AppGallery]Problems and suggestions,"Dear Customer, Thank you for contacting *****(PERSON). We hope youre doing well. In order to give you the best solution, could you please clarify your request with following information: A description of the issue A screenshot or record video of error When issue happened Your Huawei Id: App GalleryHMS coreOpen then take a screenshot Your phone model SN number of your device App Gallery Version: Huawei App GalleryMe> About HMS Core Version: Huawei App GalleryHMS coreOpen> Settings> About Related app Related app version The Log of App Gallery If you have any further questions, please feel free to reply to this email thread and we will be happy to walk you through your doubts. Sincerely, Alexandra *****(PERSON)",AppGallery ,Others,Unknown,Unknown,AppGallery  > Others > Unknown > Unknown
22983,64260,[AppGallery]Probleme și sugestii,Description No Contact Information Information ***** (Phone) sent from my Huawei phone,AppGallery ,Problem/Fault,AppGallery-Install/Upgrade,Can't install Apps,AppGallery  > Problem/Fault > AppGallery-Install/Upgrade > Can't install Apps
22983,64268,RE : [AppGallery]Probleme și sugestii,"Dear Customer, thank you for contacting Aspiegel.We hope you feel good.This email is in relation to your request on the Appgallery issue.To be able to investigate it, please provide us with the following: 1. A problem description 2. A screenshot or a video record of the error 3. The moment when the problem 4. Your Huawei ID: App Galleryhms Coredesclarythen make a screenshot 5. your phone model 6. The SN number of your device 7. App Gallery: Huawei App Galleryme> About 8. HMS Core Version: Huawei App Galleryhms11. Application journal Thank you for cooperation.For additional questions, please do not hesitate to answer this message and we will be happy to help you clarify your concerns.Sincerely, Stela team of customer assistance team A Aspiegel Se é uma Empress constituted Segundo as Leis da Ireland, com Sede Em Dublin, Ireland.Aspiegel is a provider of Huawei Mobile Services Para Huawei is Honor Property of Dispositivos na Europe, Canadá, Austlalia, Nova Zelăndia is outs países.From: xxxxxxxxxcom Sent: Thursday 01 September *** (Phone) 1141 to: XXXXXXXXCOM SUBJECT: [AppgalleryProbleme and Description Suggestions No Contact Information ***** (Phone) Sent from my Huawei Phone",AppGallery ,Others,Unknown,Unknown,AppGallery  > Others > Unknown > Unknown
22982,64259,Problems and suggestions متجر التطبيقات]المشاكل والاقتراحات,Details transfer issued.Information Information ***** (Phone),AppGallery ,Others,Unknown,Unknown,AppGallery  > Others > Unknown > Unknown
22980,64253,Aspiegel Support issue submit,Product: Other Products Requests: Requests Contact Full Name: Aust Horst Phone Number: +***** (Phone) Contact Email Address: XXXXXXXXCXCCXCXCOM SUMMARY OF THE ISSUE: German I have the Watch GT3won.I have not received any further documents that this is officially in my possession where do I get the home |News |Events |Products |Partners |Support Copyright Aspiegel SE,AppGallery ,Others,Unknown,Unknown,AppGallery  > Others > Unknown > Unknown
22980,64265,GT3,"Dear Lord ***** (per), we recommend that you contact us directly from your computer via the Discord Canal https: // Discordggdacxqnc4qf.If you have difficulties in using Discord or prefer that we will edit the case, please give us the following information for further examinations: 1. Your Huaweid 2. Your service country Appgallery> Settings> Land 2. The name of the game app3. The name of the campaign, in which you have participated 4. indicate how many huject vouchers you should receive 5. Your discord contact information, if you have any further questions, please answer this email thread and we will be happy to help you with yoursContinue to doubt.Sincerely, ***** (Per) Customer Service The Aspiegel SE is a society under Irish law based in ***** (LOC), ***** (LOC).Aspiegel SE is the provider of Huawei Mobile Services for Huawei and Honor device owners in ***** (LOC), ***** (LOC), ***** (LOC), ***** (LOC)and other countries.From: XXXXXXXXXCCCOM SENT: Thursday 01 September ***** (Phone) 1135 to: XXXXXXXXXCOM Subject: Aspiegel Support Issue Submit Product: Other Products Requests: Requests Contact Full Name: Aust Horst Phone Number: +**** (Phone) Contact Email Address: XXXXXXXXXCXCOM SUMMARY OF THE ISSUE: German please I have received the Watch GT3 at Gamescom Hall 7.I have not received any further documents that this is officially in my possession where do I get the home |News |Events |Products |Partners |Support Copyright Aspiegel SE",AppGallery ,Others,Unknown,Unknown,AppGallery  > Others > Unknown > Unknown
22980,64271,Re: GT3,"I'm sorry I don't have Discord and I won't use it either.I come from ***** (LOC) use the Mate 10 Pro.The Huawei ID: XXXXXXXXXXCOM I have no app that is to be mentioned.The action ran on 25822 in Hall 7 ,, Appgalerie ,, from 1400 on gamescom. (See photos) My question again: Where do I get the written (expression by email) confirmation that the Watch GT3 is my property.In this regard, there was nothing to the hand at gamescom.MfG ***** (per) apikosenstr6 ***** (Phone) Meckenheim ***** (LOC) wrote on Thursday, September 1st ***** (Phone), 1155: Dear Lord***** (per), we recommend that you contact the discord channel https: // discordggdacxqnc4qf directly from your computer.If you have difficulties in using Discord or prefer that we will edit the case, please give us the following information for further examinations: 1. Your Huaweid 2. Your service country Appgallery> Settings> Land 2. The name of the game app3. The name of the campaign, in which you have participated 4. indicate how many huject vouchers you should receive 5. Your discord contact information, if you have any further questions, please answer this email thread and we will be happy to help you with yoursContinue to doubt.Sincerely, ***** (Per) Customer Service The Aspiegel SE is a society under Irish law based in ***** (LOC), ***** (LOC).Aspiegel SE is the provider of Huawei Mobile Services for Huawei and Honor device owners in ***** (LOC), ***** (LOC), ***** (LOC), ***** (LOC)and other countries.From: XXXXXXXXXCCCOM SENT: Thursday 01 September ***** (Phone) 1135 to: XXXXXXXXXCOM Subject: Aspiegel Support Issue Submit Product: Other Products Requests: Requests Contact Full Name: Aust Horst Phone Number: +**** (Phone) Contact Email Address: XXXXXXXXXCXCOM SUMMARY OF THE ISSUE: German please I have received the Watch GT3 at Gamescom Hall 7.I have not received any further documents that this is officially in my possession where do I get the home |News |Events |Products |Partners |Support Copyright Aspiegel SE ***** (Phone)",AppGallery ,Others,Unknown,Unknown,AppGallery  > Others > Unknown > Unknown
22980,64280,RE : GT3,"Dear Mr. ***** (per), thank you for providing the requested information.I thank you for your patience in this long process and I apologize that you still have to wait a bit.We very much appreciate your cooperation.I will check your problem with our specialized team and inform you about possible changes as soon as possible.With friendly greeting, ***** (per) customer service The Aspiegel SE is a society under Irish law based in ***** (LOC), ***** (LOC).Aspiegel SE is the provider of Huawei Mobile Services for Huawei and Honor device owners in ***** (LOC), ***** (LOC), ***** (LOC), ***** (LOC)and other countries.From: XXXXXXXXXXXCCOM SENT: Thursday 01 September ***** (Phone) 1211 to: XXXXXXXXXXXCOM Subject :)",AppGallery ,Others,Unknown,Unknown,AppGallery  > Others > Unknown > Unknown
22980,64289,RE : GT3,"Dear Lord ***** (per), I thank you for your patience in this long process and I apologize for the waiting time.Our internal team told me that we have no way of issuing a document that proves that the price obtained is yours.I am not sure what you received when you took part in the event, but in this case either we cannot help you.Thank you for your cooperation, do not forbid you to address us if we can help you further.With friendly greeting, ***** (per) customer service The Aspiegel SE is a society under Irish law based in ***** (LOC), ***** (LOC).Aspiegel SE is the provider of Huawei Mobile Services for Huawei and Honor device owners in ***** (LOC), ***** (LOC), ***** (LOC), ***** (LOC)and other countries.From: XXXXXXXXXXXCCOM SENT: Thursday 01 September ***** (Phone) 1211 to: XXXXXXXXXXXCOM Subject :)",AppGallery ,Others,Unknown,Unknown,AppGallery  > Others > Unknown > Unknown
22978,64246,[AppGallery]Problems and suggestions,Description Nu merge instalat Contact information Vxxxxxxxxxcom,AppGallery ,Problem/Fault,AppGallery-Install/Upgrade,Can't install Apps,AppGallery  > Problem/Fault > AppGallery-Install/Upgrade > Can't install Apps
22978,64255,RE : [AppGallery]Problems and suggestions,"Dear Customer, thank you for contacting Aspiegel.We hope you are fine.To give you the best solution, we asked for the following information: 1. A description of the problem.2. A screenshot or error video recording.3. The moment when the problem occurred.4. Your Huawei Ident: Appgalleryhms Coredespose then make a screenshot.5.8. HMS Core Version: Huawei Appgalleryhms CoredesclasestaştiBout.9. Associated application.10. The version of the associated application.11. The Appgallery register if you have any additional questions, do not hesitate to answer this email and we will be happy to help you clarify your doubts.With respect, Claudiu Aspiegel",AppGallery ,Others,Unknown,Unknown,AppGallery  > Others > Unknown > Unknown
22977,64245,[AppGallery]Problems and suggestions,Description does not install contact information vxxxxxxxcom,AppGallery ,Problem/Fault,AppGallery-Install/Upgrade,Can't install Apps,AppGallery  > Problem/Fault > AppGallery-Install/Upgrade > Can't install Apps
22972,64235,[AppGallery]Probleme și sugestii,Description does not go stumble Guysul Contact Information I can't say sent from my Huawei phone,AppGallery ,Problem/Fault,AppGallery-Install/Upgrade,Can't install Apps,AppGallery  > Problem/Fault > AppGallery-Install/Upgrade > Can't install Apps
22972,64242,RE : [AppGallery]Probleme și sugestii,"Dear Customer, thank you for contacting Aspiegel.We hope you feel good.This email is in relation to your request on the Appgallery issue.To be able to investigate it, please provide us with the following: 1. A problem description 2. A screenshot or a video record of the error 3. The moment when the problem 4. Your Huawei ID: App Galleryhms Coredesclarythen make a screenshot 5. your phone model 6. The SN number of your device 7. App Gallery: Huawei App Galleryme> About 8. HMS Core Version: Huawei App Galleryhms11. Application journal Thank you for cooperation.For additional questions, please do not hesitate to answer this message and we will be happy to help you clarify your concerns.Sincerely, Stela team of customer assistance team A Aspiegel Se é uma Empress constituted Segundo as Leis da Ireland, com Sede Em Dublin, Ireland.Aspiegel is a provider of Huawei Mobile Services Para Huawei is Honor Property of Dispositivos na Europe, Canadá, Austlalia, Nova Zelăndia is outs países.From: xxxxxxxxxcom Sent: Thursday 01 September *** (Phone) 1109 to: xxxxxxxxcom subject: [appgalmeryprobleme and suggestions Description does not go stumble contact information can not say sent from my phone huawei",AppGallery ,Others,Unknown,Unknown,AppGallery  > Others > Unknown > Unknown
22964,64204,Bonus place my Re: support.pt 自动回复: [AppGallery]Проблемы и предложения,,AppGallery ,Others,Unknown,Unknown,AppGallery  > Others > Unknown > Unknown
22964,64211,RE : Bonus place my Re: support.pt 自动回复: [AppGallery]Проблемы и предложения,"Dear Customer, Thank you for contacting *****(PERSON). We hope youre doing well. In order to give you the best solution, could you please clarify your request with following information: A description of the issue A screenshot or record video of error When issue happened Your Huawei Id: App GalleryHMS coreOpen then take a screenshot Your phone model SN number of your device App Gallery Version: Huawei App GalleryMe> About HMS Core Version: Huawei App GalleryHMS coreOpen> Settings> About Related app Related app version The Log of App Gallery If you have any further questions, please feel free to reply to this email thread and we will be happy to walk you through your doubts. Sincerely, Alexandra *****(PERSON)",AppGallery ,Others,Unknown,Unknown,AppGallery  > Others > Unknown > Unknown
22964,64204,Bonus place my Re: support.pt 自动回复: [AppGallery]Проблемы и предложения,,AppGallery ,Others,Unknown,Unknown,AppGallery  > Others > Unknown > Unknown
22963,64202,[AppGallery]Проблемы и предложения,Timestamp: *****(PHONE)-0628T111739Z Message: AADSTS*****(PHONE): The endpoint only accepts POST requests. Received a GET request. Контактные данные *****(PHONE) Request Id: *****(PHONE)-ae29-*****(PHONE)-bed16d*****(PHONEa400 Correlation Id: bdd986f67e0c4a65a7dc1c*****(PHONEa*****(PHONE),AppGallery ,Others,Unknown,Unknown,AppGallery  > Others > Unknown > Unknown
22963,64209,RE : [AppGallery]Проблемы и предложения,"Dear Customer, Thank you for contacting *****(PERSON). We hope youre doing well. In order to give you the best solution, could you please clarify your request with following information: A description of the issue A screenshot or record video of error When issue happened Your Huawei Id: App GalleryHMS coreOpen then take a screenshot Your phone model SN number of your device App Gallery Version: Huawei App GalleryMe> About HMS Core Version: Huawei App GalleryHMS coreOpen> Settings> About Related app Related app version The Log of App Gallery If you have any further questions, please feel free to reply to this email thread and we will be happy to walk you through your doubts. Sincerely, Alexandra *****(PERSON)",AppGallery ,Others,Unknown,Unknown,AppGallery  > Others > Unknown > Unknown
22962,64200,VIP September special CH,how do i become a VIP if i do saw if its right you have to spend *****(PHONE) CHF every month and i spend over *****(PHONE) CHF i wanted to ask i do i get the VIP for the exclusive monthly offer.,AppGallery ,Problem/Fault,VIP / Offers / Promotions,Offers / Vouchers / Promotions,AppGallery  > Problem/Fault > VIP / Offers / Promotions > Offers / Vouchers / Promotions
22962,64225,RE : VIP September special CH,"Dear customer, Thank you for contacting *****(PERSON). We hope youre doing well. This email is in regards to your concern about how to become a VIP. Can you please give us more details about the campaign you are trying to participate so we can assist further? -The nametitle of the campaign - The activity regioncountry If you have any further questions, please feel free to reply to this email thread and we will be happy to walk you through your doubts. Sincerely, Stela *****(PERSON)",AppGallery ,Problem/Fault,VIP / Offers / Promotions,Offers / Vouchers / Promotions,AppGallery  > Problem/Fault > VIP / Offers / Promotions > Offers / Vouchers / Promotions
22962,64230,Re: RE : VIP September special CH,"the name: VIP september special CH (vip users only) country : Switzerland ‫בתאריך יום ה׳, 1 בספט׳ *****(PHONE) ב1149 מאת <‪xxxxxxxxxcom‬‏>:‬ Dear customer, Thank you for contacting *****(PERSON). We hope youre doing well. This email is in regards to your concern about how to become a VIP. Can you please give us more details about the campaign you are trying to participate so we can assist further? -The nametitle of the campaign - The activity regioncountry If you have any further questions, please feel free to reply to this email thread and we will be happy to walk you through your doubts. Sincerely, Stela *****(PERSON)",AppGallery ,Problem/Fault,VIP / Offers / Promotions,Offers / Vouchers / Promotions,AppGallery  > Problem/Fault > VIP / Offers / Promotions > Offers / Vouchers / Promotions
22962,64411,RE : VIP September special CH,"Dear customer, We hope you are doing well. We are bringing you an answer regarding your concern. After checks, it seemed that the VIP Campaign page had an issue which is fixed now. In this case, we advise you to click on AppGalleryCampaignsVIP September Special CH and you will be able to find all the information and the Terms & Conditions at the end. In the Terms &Conditions it is specified: ""5. How to Enter. 51 Any user who makes purchases by debitcredit card, direct carrier billing, or PayPal in all games that downloaded from AppGallery/ Game Center may opt to participate in the campaign. 52 This offer is only available to Huawei and other Android device users whose unique Huawei ID is registered within the Campaign territory stated in Section 3, where the Participant also resides. The participants Huawei ID service region and IP address shall also correspond to their country of residence. "" At the end of the campaign Terms & Conditions, you can also find the list of the games. If you have any further questions, please feel free to reply to this email thread and we will be happy to walk you through your doubts. Sincerely, Stela Aspiegel",AppGallery ,Problem/Fault,VIP / Offers / Promotions,Offers / Vouchers / Promotions,AppGallery  > Problem/Fault > VIP / Offers / Promotions > Offers / Vouchers / Promotions
22962,64425,Re: RE : VIP September special CH,"if its fine to ask whats new in september month? ‫בתאריך יום ה׳, 1 בספט׳ *****(PHONE) ב1710 מאת <‪xxxxxxxxxcom‬‏>:‬ Dear customer, We hope you are doing well. We are bringing you an answer regarding your concern. After checks, it seemed that the VIP Campaign page had an issue which is fixed now. In this case, we advise you to click on AppGalleryCampaignsVIP September Special CH and you will be able to find all the information and the Terms & Conditions at the end. In the Terms &Conditions it is specified: ""5. How to Enter. 51 Any user who makes purchases by debitcredit card, direct carrier billing, or PayPal in all games that downloaded from AppGallery/ Game Center may opt to participate in the campaign. 52 This offer is only available to Huawei and other Android device users whose unique Huawei ID is registered within the Campaign territory stated in Section 3, where the Participant also resides. The participants Huawei ID service region and IP address shall also correspond to their country of residence. "" At the end of the campaign Terms & Conditions, you can also find the list of the games. If you have any further questions, please feel free to reply to this email thread and we will be happy to walk you through your doubts. Sincerely, Stela Aspiegel",AppGallery ,Problem/Fault,VIP / Offers / Promotions,Offers / Vouchers / Promotions,AppGallery  > Problem/Fault > VIP / Offers / Promotions > Offers / Vouchers / Promotions
22962,64469,Reply,"Dear user, Thank you for your cooperation. To build better game experience, we build discord channel to update you the latest game campaign, discount activities, and provide you direct services. We recommend you to use our discord channel therefore, you can directly contact our dedicated game operation staff through discord channel. Here is the discord link that serves your country (Switzerland): https://discordggdaCXQNc4Q We hope this information is useful and that it will solve your problem. If you have any further questions, please do not hesitate to reply to this email and we will be happy to help you resolve your doubts. Sincerely, Madalin Aspiegel",AppGallery ,Others,Unknown,Unknown,AppGallery  > Others > Unknown > Unknown
22959,64193,g[AppGallery]Problem och försla[Ap[AppGallery]Problems and suggestionspGallery]Problem och förslag,Description No certificates were found.Contact Information AXXXXXXXXXXCOM,AppGallery ,Problem/Fault,General,Security issue / malware,AppGallery  > Problem/Fault > General > Security issue / malware
22959,64406,RE : [AppGallery]Problem och förslag[AppGallery]Problems and suggestions,"Dear Customer, Thank you for contacting *****(PERSON). We hope youre doing well. In order to give you the best solution, could you please clarify your request with following information: 1. A description of the issue 2. A screenshot or record video of error 3. When issue happened 4. Your Huawei Id: App GalleryHMS coreOpen then take a screenshot 5. Your phone model 6. SN number of your device 7. App Gallery Version: Huawei App GalleryMe> About 8. HMS Core Version: Huawei App GalleryHMS coreOpen> Settings> About 9. Related app 10. Related app version 11. The Log of App Gallery If you have any further questions, please feel free to reply to this email thread and we will be happy to walk you through your doubts. Sincerely, *****(PERSON)",AppGallery ,Others,Unknown,Unknown,AppGallery  > Others > Unknown > Unknown
22956,64184,Problème cashback,"Hello, I send you this message because I did not receive cashback on an offer available photo to lappui, the bot is not known to my addition and sends me back to you.The problem is not recurring it arrived on August 28 Huawei id: ***** (phone) Thank you Matteo Convert",AppGallery ,Problem/Fault,Coupon/Gifts/Points Issues,Can't use or acquire,AppGallery  > Problem/Fault > Coupon/Gifts/Points Issues > Can't use or acquire
