Ticket id,Interaction id,Ticket Summary,Interaction content,Type 1,Type 2,Type 3,Type 4,hierarchical_label
24310,68365,[HUAWEI Music] Problems and Suggestions,MXXXXXXXXXXCOM Sent from my phone Huawei,AppGallery ,Others,Unknown,Unknown,AppGallery  > Others > Unknown > Unknown
24075,67730,[AppGallery]Probleme und Vorschläge,Description update cannot be installed contact information SXXXXXXXXCCOMDEPTION UPDATE BE Installed Contact SXXXXXXXXCOM DESCRIPTION UPDATE BE Installed Contact Sxxxxxxxxxxxxxxxxxxxxxxxxxxxxxxxxxxxxxxxxxxxxxxxxxxxxxxxxx,AppGallery ,Problem/Fault,AppGallery-Install/Upgrade,Can't update Apps,AppGallery  > Problem/Fault > AppGallery-Install/Upgrade > Can't update Apps
24075,67762,Re: RE : [AppGallery]Probleme und Vorschläge Re: RE : [AppGallery]Problems and Suggestions,"Thanks after reinstalling the app, everything works perfectly MfG ***** (per) wrote on Thursday, 8th Sep.***** (Phone), 2042: Dear customer, thank you for making contact with Aspiegel.We hope you are doing well.In order to be able to offer you the best solution, we ask you to clarify your request with the following information: 1. A description of the problem 2. A screenshot or a video recording of error 3. When the problem occurred 4. Your Huaweid: appOpen galleryhms and then make a screenshot 5. Your mobile phone model 6. Sn number of your device 7. Version of the Appgalerie: Huawei Appgaleriemich> About 8. HMS Core version: Huawei Appgalerie Kerne> Settings> About 9. Related app 10. Version of related app 11.The AppGalerie protocol If you have any further questions, please answer this email thread and we will be happy to help you.Sincerely, ***** (per)",AppGallery ,Problem/Fault,AppGallery-Install/Upgrade,Can't update Apps,AppGallery  > Problem/Fault > AppGallery-Install/Upgrade > Can't update Apps
23748,66706,[AppGallery]Problems and suggestions,Description . Contact information Axxxxxxxxxcom,AppGallery ,Suggestion,AppGallery-Use,Others,AppGallery  > Suggestion > AppGallery-Use > Others
23740,66684,Unknown,I paid but lapplication did not work I can be reimbursed.Thanks I have I Paid But the Application Did Not Work Can I Be Refunded.THANK YOU,AppGallery ,Problem/Fault,Third Party APPs,Refund,AppGallery  > Problem/Fault > Third Party APPs > Refund
23683,66429,Aspiegel Support issue submit,"Product: AppGallery & Games Requests: Using AppGallery (ie. manage service country) Contact Full Name: Inês Lavrador Ramos Phone Number: +*****(PHONE) Contact Email Address: xxxxxxxxxcom Summary of the issue: Good morning! I would like to know how I can use a voucher that I won on app gallery since the store now was put together with other store, and I still have the voucher to use! thanks in advance! Home | News | Events | Products | Partners | Support Copyright Aspiegel SE",AppGallery ,Suggestion,VIP / Offers / Promotions,Offers / Vouchers / Promotions,AppGallery  > Suggestion > VIP / Offers / Promotions > Offers / Vouchers / Promotions
23683,67433,Re: RE : Aspiegel Support issue submit,"Hello , good morning! So the campaign name was ""XMAS download and win play PT"" as you will see in the screenshot I will send you, and I won a voucher to use it in a online store called ""*****(PERSON)"" but now ""*****(PERSON)"" is a part of other companystore called ""*****(PERSON)"" And whats my Huawei Id service country? Thanks in advance! A ter, 6 de set de *****(PHONE), 1216, escreveu: Dear Customer, Thank you for contacting *****(PERSON). We hope youre doing well. This email is regarding your concern about *****(PERSON) worry I will do my best to solve your problem as soon as possible. In order to analyze your case in detail I will need the following information from you: Error screenshot The name of the champagne you have attended Your Huawei Id Service country We would greatly appreciate your feedback regarding our email exchange, as we need your input to keep improving our service. Therefore, we invite you to fill in the survey that will soon arrive on the email address you used to contact us. If you have any further questions, please feel free to reply to this email thread and we will be happy to walk you through your doubts. Sincerely, Silvia *****(PERSON)",AppGallery ,Suggestion,VIP / Offers / Promotions,Offers / Vouchers / Promotions,AppGallery  > Suggestion > VIP / Offers / Promotions > Offers / Vouchers / Promotions
23683,67516,Re: RE : Aspiegel Support issue submit,"I have to an account there?So I Dont Speak German!Escreveu No Dia Quinta, 809/***** (Phone) às) 1208: Dear customer, we recommend that you contact us directly from your computer via the Discord Canal https: // Discordggtkyzc5cagu.***** (person) to use Discord, or if you prefer that we will edit the case, please give us the following information for further examinations: - Your Service APPGALLERY> ITE> Land - Your discord contact information,If applicable if you have any further questions, please answer this email and we will be happy to help you with your doubts.***** (person), Andrea ***** (person)",AppGallery ,Suggestion,VIP / Offers / Promotions,Offers / Vouchers / Promotions,AppGallery  > Suggestion > VIP / Offers / Promotions > Offers / Vouchers / Promotions
23683,67915,Re: RE : Aspiegel Support issue submit,"Sure, the country of my app gallery and my country is Portugal! I cant enter on discord sorry, I dont understand it! A qui, 8 de set de *****(PHONE), 1307, escreveu: Dear Customer, This email is regarding your concern about *****(PERSON) voucher. We recommend that you contact us through the Discord channel https://discordggtkYZC5CAGu directly from your computer. If you are having difficulty using Discord, or if you prefer us to handle the case, please provide us with the following information for further investigation: - Your country of service AppGallery> Me> Settings> Country. - Your Discord contact information, if applicable. If you have any further questions, please reply to this eMail and we will be happy to help you with your doubts. Sincerely, Andrea *****(PERSON)",AppGallery ,Suggestion,VIP / Offers / Promotions,Offers / Vouchers / Promotions,AppGallery  > Suggestion > VIP / Offers / Promotions > Offers / Vouchers / Promotions
23624,66266,[GameCentre]Problems and suggestions,Description No Moontoon Contact information xxxxxxxxxcom,AppGallery ,Problem/Fault,AppGallery-Install/Upgrade,Can't download Apps,AppGallery  > Problem/Fault > AppGallery-Install/Upgrade > Can't download Apps
23555,65977,[AppGallery]Problemas e sugestões,"Description I don't understand the DNS never working ', can you help me ???Contact information ***** (Phone).- XXXXXXXXXCOM Sent from my mobile phone description i dont understand why dns is never works, can you help me?Contact Information ***** (Phone).- xxxxxxxxcom",AppGallery ,Problem/Fault,General,Cannot connect - Server,AppGallery  > Problem/Fault > General > Cannot connect - Server
23534,65883,[AppGallery]Probleme und Vorschläge,Description Komit cannot be installed.Contact information XXXXXXXXXXCOM SET SETER SET,AppGallery ,Problem/Fault,AppGallery-Install/Upgrade,Unknown,AppGallery  > Problem/Fault > AppGallery-Install/Upgrade > Unknown
23477,65661,Re: support.pt 自动回复: [AppGallery]Problems and suggestions,"Huawi health On Mon, 5 Sept *****(PHONE), 140 pm , wrote: Hi, We appreciate your contact! Our support representatives will check your message and get back to you as soon as possible. We appreciate your patience and cooperation. Sincerely, Aspiegel",AppGallery ,Others,Unknown,Unknown,AppGallery  > Others > Unknown > Unknown
23452,65616,[AppGallery]Problemas e sugestões,Description cant install Contact Information 962 225 736 .,AppGallery ,Problem/Fault,AppGallery-Install/Upgrade,Can't install Apps,AppGallery  > Problem/Fault > AppGallery-Install/Upgrade > Can't install Apps
23429,65569,[AppGallery]Problemas e sugestões,Description does not install contact information xxxxxxxxxxxxxcrement does not install contact information xxxxxxxxxx,AppGallery ,Problem/Fault,AppGallery-Install/Upgrade,Can't install Apps,AppGallery  > Problem/Fault > AppGallery-Install/Upgrade > Can't install Apps
23395,65482,[AppGallery]Problemi e soluzioni,Description In the area where I am (*****(LOC)) there is no connection (3 Fastweb devices) and we have difficulties with calls. No connection to the Internet. Contact information *****(PHONE) - *****(PHONE) - *****(PHONE),AppGallery ,Others,Unknown,Unknown,AppGallery  > Others > Unknown > Unknown
23230,65024,[AppGallery]Проблеми и предложения,Description Whats up Contact info *****(PHONE),AppGallery ,Others,Unknown,Unknown,AppGallery  > Others > Unknown > Unknown
23229,65022,[AppGallery]Проблеми и предложения,Description Whats Up Contact Information ***** (Phone) Sent from my Huawei Phone,AppGallery ,Others,Unknown,Unknown,AppGallery  > Others > Unknown > Unknown
23212,64982,[AppGallery]Проблеми и предложения,OK Description Whats Up Contact Information ***** (Phone) Sent from my Huawei Phone,AppGallery ,Others,Unknown,Unknown,AppGallery  > Others > Unknown > Unknown
23194,64946,[AppGallery]Problemer og forslag,Description Installation Error Contact Information ***** (Phone),AppGallery ,Problem/Fault,AppGallery-Install/Upgrade,Other download/install/update issue,AppGallery  > Problem/Fault > AppGallery-Install/Upgrade > Other download/install/update issue
23193,64944,[AppGallery]Problemer og forslag,Description Installation Error Contact Information +***** (Phone) ***** (Per),AppGallery ,Problem/Fault,AppGallery-Install/Upgrade,Other download/install/update issue,AppGallery  > Problem/Fault > AppGallery-Install/Upgrade > Other download/install/update issue
23189,64938,[AppGallery]Проблеми и предложения,Description I beg you to drive them.Contact Information XXXXXXXXXcom,AppGallery ,Suggestion,General,Personal data,AppGallery  > Suggestion > General > Personal data
23188,64936,[AppGallery]Проблеми и предложения,Description W. Contact Information XXXXXXXXXCOM,AppGallery ,Suggestion,General,Personal data,AppGallery  > Suggestion > General > Personal data
23056,64550,[AppGallery]Problems and suggestions,"Description My phone data and privacy is insecure...all apps and accounts are copied and shared by third parties without my consent. I wish to report that everything used here is still not private. As we speak, Im scared and frustrated about this issue. Contact information xxxxxxxxxcom",AppGallery ,Suggestion,General,Personal data,AppGallery  > Suggestion > General > Personal data
23055,64549,[AppGallery]Problemy i sugestie,Description inability to install contact information xxxxxxxxcom,AppGallery ,Problem/Fault,AppGallery-Install/Upgrade,Other download/install/update issue,AppGallery  > Problem/Fault > AppGallery-Install/Upgrade > Other download/install/update issue
23054,64548,[AppGallery]Problemy i sugestie,Description No Installation Passible Contact Information XXXXXXXXCOMS Inability to install contact information xxxxxxxxcom,AppGallery ,Problem/Fault,AppGallery-Install/Upgrade,Other download/install/update issue,AppGallery  > Problem/Fault > AppGallery-Install/Upgrade > Other download/install/update issue
23052,64544,[AppGallery]Sorunlar ve öneriler,Description does not load.Contact Information 0 543 375 79 90,AppGallery ,Problem/Fault,General,AppGallery not loading,AppGallery  > Problem/Fault > General > AppGallery not loading
23050,64542,Re: RE : OD: Full refund from first day,"Hello, I already sent to them email twice with reminder two weeks ago, but they never replied. They fixed bug after I was impacted, and they want to shut it down to be silence as we see. I kindly asking to make a refund because of this situation. Thank You for Your support to making it possible. Kind regards, Client From: xxxxxxxxxcom Sent: Wednesday, August 10, *****(PHONE) 230 PM To: xxxxxxxxxcom Subject: RE : OD: Full refund from first day Dear customer, We appreciate you patience, our internal team reached us back and they informed us that they suggest you to contact developer first with the proof that the products are not as advertised and if developer agrees to refund, you can provide that proof to us. You should be able to contact the Customer support of the game on: https://aihelpnetprivacypolicy/ or Customer Service: xxxxxxxxxcom. If you have further game issue, you also can directly contact our dedicated game operation staff through discord channel. Here is the discord link (Poland): https://discordggtkYZC5CAGu that serves your country. We would greatly appreciate your feedback regarding our email exchange, as we need your input to keep improving our service. Therefore, we invite you to fill in the survey that will soon arrive on the email address you used to contact us. If you have any further questions, please feel free to reply to this email thread and we will be happy to walk you through your doubts. Sincerely, Ramon Aspiegel",AppGallery ,Problem/Fault,Third Party APPs,Refund,AppGallery  > Problem/Fault > Third Party APPs > Refund
23049,64540,[AppGallery]Problémy a odporúčania,Description Failed to Install Update Mi Vydeoplayer Contact Information XXXXXXXXCOMOPTE FAILABLE Installation Installing Mi Vydeoplayer Contact Information XXXXXXXXCOM contact information,AppGallery ,Problem/Fault,AppGallery-Install/Upgrade,Can't update Apps,AppGallery  > Problem/Fault > AppGallery-Install/Upgrade > Can't update Apps
23047,64532,Ynt: RE : Ynt: RE : Unreceived Huawei Points,"It is ok, I dont request anything. You may close the ticket. Thanks *****(PERSON): xxxxxxxxxcom Gönderildi: 1 Eylül *****(PHONE) Perşembe 1909 Kime: xxxxxxxxxcom Konu: RE : Ynt: RE : Unreceived *****(PERSON) Dear user, Thank you for contacting *****(PERSON). We hope youre doing well. This email is in regards to your concern about your Campaign Cashback 15%. To create a better game experience, we built a discord channel to update you the latest game campaign, discount activities, and also provide you direct services. We recommend you to use our discord channel. We recommend you contact us via discord channel : https://discordggtkYZC5CAGu from your computer desktop directly. If you have any difficulties using discord or you prefer us to handling the case, will you please provide us following information for further investigation: 1. Your Huawei id 2. Your service country AppGallery> Me> Settings> Country 2. The name of the game app 3. The name of the campaign you participated in 4. Outline how many HUAWEI PointsCouponPrize you were meant to receive 5. Your discord account contact information if applicable If you have any further questions, please feel free to reply to this email thread and we will be happy to walk you through your doubts. Sincerely, Madalin *****(PERSON)",AppGallery ,Problem/Fault,Coupon/Gifts/Points Issues,Can't use or acquire,AppGallery  > Problem/Fault > Coupon/Gifts/Points Issues > Can't use or acquire
23046,64531,Aspiegel Support issue submit,PRODUCT: APPGALLERY & GAMES REQUESTS: OTER REQUESTS CONTACT FULL NAME: MIGUEL LOSADA SEOANE PHONE NUMBER: +***** (Phone) CONTACT EMAIL ADDRESS: XXXXXXXXXXcom HUAWEII won a raffle but after more than a week I did not receive it and I do not know who I have to get in touch ... Greetings Home |News |Events |Products |Partners |Support Copyright Aspiegel,AppGallery ,Problem/Fault,Coupon/Gifts/Points Issues,Can't use or acquire,AppGallery  > Problem/Fault > Coupon/Gifts/Points Issues > Can't use or acquire
23044,64525,[AppGallery]Problemas y sugerencias,Description I have the bale cell and it does not let me uninstall anything at all contact information exxxxxxxxxxxcom,AppGallery ,Problem/Fault,AppGallery-Use,UI Abnormal in Huawei AppGallery,AppGallery  > Problem/Fault > AppGallery-Use > UI Abnormal in Huawei AppGallery
23029,64464,Re: RE : Refund request,I did and all they did 3 days soft ban which is ridiculous ),AppGallery ,Problem/Fault,Third Party APPs,Refund,AppGallery  > Problem/Fault > Third Party APPs > Refund
23025,64447,Ynt: RE : Unreceived Huawei Points,"Hello again Here is the information you requested : 1. My Huawei ID : xxxxxxxxxcom 2. Your service country : Turkey 2. The name of the game app : World Of Tanks Blitz 3. The name of the campaign you participated in : App Gallery Game Festival Campaign (15% Cashback) 4. How many HUAWEI PointsCoupon I was meant to receive : About 9 TL 5. My discord account contact information : Icebreaker #*****(PHONE) Gönderen: xxxxxxxxxcom Gönderildi: 1 Eylül *****(PHONE) Perşembe 1653 Kime: xxxxxxxxxcom Konu: RE : Unreceived *****(PERSON) Dear customer, Thank you for contacting *****(PERSON). We hope youre doing well. This email is in regards to your concern about World Of Tanks Blitz cashback. To build better game experience, we build discord channel to update you the latest game campaign, discount activities, and provide you direct services. We recommend you to use our discord channel. Please go to Huawei App GalleryCampaignClick any valid campaign on the list> find discord icon in the page > Click the link and Join. If you have any difficulties using discord or you prefer us to handling the case, will you please provide us following information for further investigation: 1. Your Huawei ID. 2. Your service country AppGallery> Me> Settings> Country. 2. The name of the game app. 3. The name of the campaign you participated in. 4. Outline how many HUAWEI PointsCoupon you were meant to receive. 5. Your discord account contact information if applicable. If you have any further questions, please feel free to reply to this email thread and we will be happy to walk you through your doubts. We would very much appreciate your feedback on our email exchange, as we need your opinion to continue to improve our service. Therefore, we invite you to fill out the survey that will soon be sent to the email address you used to contact us. Sincerely, *****(PERSON). *****(PERSON)",AppGallery ,Problem/Fault,Coupon/Gifts/Points Issues,Can't use or acquire,AppGallery  > Problem/Fault > Coupon/Gifts/Points Issues > Can't use or acquire
23025,64468,RE : Ynt: RE : Unreceived Huawei Points,"Dear user, Thank you for contacting *****(PERSON). We hope youre doing well. This email is in regards to your concern about your Campaign Cashback 15%. To create a better game experience, we built a discord channel to update you the latest game campaign, discount activities, and also provide you direct services. We recommend you to use our discord channel. We recommend you contact us via discord channel : https://discordggtkYZC5CAGu from your computer desktop directly. If you have any difficulties using discord or you prefer us to handling the case, will you please provide us following information for further investigation: 1. Your Huawei id 2. Your service country AppGallery> Me> Settings> Country 2. The name of the game app 3. The name of the campaign you participated in 4. Outline how many HUAWEI PointsCouponPrize you were meant to receive 5. Your discord account contact information if applicable If you have any further questions, please feel free to reply to this email thread and we will be happy to walk you through your doubts. Sincerely, Madalin *****(PERSON)",AppGallery ,Problem/Fault,Coupon/Gifts/Points Issues,Can't use or acquire,AppGallery  > Problem/Fault > Coupon/Gifts/Points Issues > Can't use or acquire
23024,64446,[AppGallery]Questions et suggestions,DESCRIPTION PB connection to wifi and mobile data.Contact information xxxxxxxxcom sent from my mobile Huawei,AppGallery ,Suggestion,AppGallery-Use,Others,AppGallery  > Suggestion > AppGallery-Use > Others
23024,64465,RE : [AppGallery]Questions et suggestions,"Dear customer, thank you without contacted aspiegel.We hope you are well.This email is about your concern about your problem with Appgallery.In order to be able to do a dapprofond lenquer, can you please provide us with the following elements: 1. A description of the problem 2. A screenshot or a video recording of Lerrer 3. When the problem is produced 4. Your Huawei identifier: App Galleryhms CorewoverThen make a scene.5. The model of your phone 6. The SN number of your device 7. App Gallery version: Huawei app gallery about 8. HMS Core version: Huawei App Galleryhms Coreououroters Apply for 9. Application concerned 10. Lapplication version concerned 11.For other questions, do not hesitate to answer this thread and we will be happy to guide you through your doubts.Cordially, ***** (per) dassistance to the customers daspiegel a aspiegel is uma empresa constituída segundo as leis da irlanda, com sede em ***** (loc), Irlanda.Aspiegel is o proven of Huawei Mobile Services Para Huawei e Honor Proprietários de Payroll Na Europa, Canada, Austrália, Nova Zelândia e Outros Países.From: xxxxxxxxxxcom feel: Thursday 01 September ***** (Phone) 1723 TO: xxxxxxxxxcom Subject: [Appgalleryquestions and suggestions Description PB Connection to WiFi and Mobile Data.Contact information xxxxxxxxcom sent from my mobile Huawei",AppGallery ,Suggestion,AppGallery-Use,Others,AppGallery  > Suggestion > AppGallery-Use > Others
23021,64426,[AppGallery]Problems and suggestionsї[AppGallery]Проблеми та пропозиції,Description Unable to install app contact information ixxxxxxxxxxxxcom sent from my Huawei phone,AppGallery ,Problem/Fault,AppGallery-Install/Upgrade,Can't install Apps,AppGallery  > Problem/Fault > AppGallery-Install/Upgrade > Can't install Apps
23017,64414,Re: RE : Refund request,"That is very unfortunate because Ive been contacting PayPal and Huawei for the past few months and never gotten and reply until I found out this email. I did report it to the game developer but they decided to only soft ban those people for 3 days and let them keep whatever they gotten for illegal third party recharge, which makes the game environment unfair for us paying the full price using legit recharge platform. )",AppGallery ,Problem/Fault,Third Party APPs,Refund,AppGallery  > Problem/Fault > Third Party APPs > Refund
23017,64443,RE : Refund request,"Dear customer, We apologize for the inconvenience. We advise you to contact the developers for your refund request. Thank you for your understanding. Sincerely, Alexandru *****(PERSON)",AppGallery ,Problem/Fault,Third Party APPs,Refund,AppGallery  > Problem/Fault > Third Party APPs > Refund
23012,64379,[AppGallery]Problems and suggestions,Description Haiii buba Contact information BEYEKEITAxxxxxxxxxcom,AppGallery ,Others,Unknown,Unknown,AppGallery  > Others > Unknown > Unknown
23012,64388,Informations,"Dear Customer, Thank you for contacting *****(PERSON). We hope youre doing well. In order to give you the best solution, could you please clarify your request with following information: A description of the issue A screenshot or record video of error When issue happened Your Huawei Id: App GalleryHMS coreOpen then take a screenshot Your phone model SN number of your device App Gallery Version: Huawei App GalleryMe> About HMS Core Version: Huawei App GalleryHMS coreOpen> Settings> About Related app Related app version The Log of App Gallery If you have any further questions, please feel free to reply to this email thread and we will be happy to walk you through your doubts. With kind regards, Marian *****(PERSON)",AppGallery ,Others,Unknown,Unknown,AppGallery  > Others > Unknown > Unknown
23007,64360,Unreceived Huawei Points,Hello I have recently made an ingame purchase (World Of Tanks Blitz) but havent received 15% Huawei Points because of that purchase. My Huawei account has the the same email with this one. Please transfer the relevant amount of Huawei points into my account. Best Regards,AppGallery ,Problem/Fault,Coupon/Gifts/Points Issues,Can't use or acquire,AppGallery  > Problem/Fault > Coupon/Gifts/Points Issues > Can't use or acquire
23007,64396,RE : Unreceived Huawei Points,"Dear customer, Thank you for contacting *****(PERSON). We hope youre doing well. This email is in regards to your concern about World Of Tanks Blitz cashback. To build better game experience, we build discord channel to update you the latest game campaign, discount activities, and provide you direct services. We recommend you to use our discord channel. Please go to Huawei App GalleryCampaignClick any valid campaign on the list> find discord icon in the page > Click the link and Join. If you have any difficulties using discord or you prefer us to handling the case, will you please provide us following information for further investigation: 1. Your Huawei ID. 2. Your service country AppGallery> Me> Settings> Country. 2. The name of the game app. 3. The name of the campaign you participated in. 4. Outline how many HUAWEI PointsCoupon you were meant to receive. 5. Your discord account contact information if applicable. If you have any further questions, please feel free to reply to this email thread and we will be happy to walk you through your doubts. We would very much appreciate your feedback on our email exchange, as we need your opinion to continue to improve our service. Therefore, we invite you to fill out the survey that will soon be sent to the email address you used to contact us. Sincerely, *****(PERSON). *****(PERSON)",AppGallery ,Problem/Fault,Coupon/Gifts/Points Issues,Can't use or acquire,AppGallery  > Problem/Fault > Coupon/Gifts/Points Issues > Can't use or acquire
23003,64352,[AppGallery]Probleme și sugestii,Description does not go to install stumble Guys Information contact xxxxxxxxcom sent from my huawei phone,AppGallery ,Problem/Fault,AppGallery-Install/Upgrade,Can't install Apps,AppGallery  > Problem/Fault > AppGallery-Install/Upgrade > Can't install Apps
